{
  "spec_version": "0.1.0",
  "name": "g1-track",
  "robot": {
    "id": "unitree-g1-29dof",
    "source": "catalog"
  },
  "task": {
    "recipe": "g1-track",
    "language": "Track a reference motion on flat ground."
  },
  "train": {
    "method": "rl",
    "seed": 1
  },
  "backend": {
    "prefer": ["mjlab"],
    "compute": "local-docker"
  }
}
