{
  "spec_version": "0.1.0",
  "name": "g1-pickplace-fixed",
  "robot": {
    "id": "unitree-g1-29dof",
    "source": "catalog"
  },
  "task": {
    "recipe": "g1-pickplace-fixed",
    "language": "Pick up the object and put it in the basket (Isaac G1 fixed-base upper body)."
  },
  "train": {
    "method": "imitation",
    "seed": 1
  },
  "backend": {
    "prefer": ["isaaclab"],
    "compute": "local-docker"
  }
}
