{
  "spec_version": "0.1.0",
  "name": "g1-reach",
  "robot": {
    "id": "unitree-g1-29dof",
    "source": "catalog"
  },
  "task": {
    "recipe": "g1-reach"
  },
  "train": {
    "method": "rl",
    "seed": 1
  },
  "backend": {
    "prefer": ["mjlab", "isaaclab"],
    "compute": "local-docker"
  }
}
